{
  "$schema": "https://json-schema.org/draft/2020-12/schema",
  "$id": "https://kieranmcshane.github.io/rating-lab/player-schema.json",
  "title": "Rating Lab historical football-player payload",
  "type": "object",
  "required": [
    "schema_version",
    "generated_at",
    "source",
    "methodology",
    "cohorts"
  ],
  "properties": {
    "schema_version": {
      "const": "1.6.0"
    },
    "generated_at": {
      "type": "string"
    },
    "source": {
      "type": "object"
    },
    "methodology": {
      "type": "object"
    },
    "cohorts": {
      "type": "array",
      "minItems": 1
    }
  },
  "additionalProperties": false
}
