{"schema_version":"1.6.0","generated_at":"2026-07-23T21:59:00+00:00","source":{"name":"Cohort-specific verified sources","url":"https://kieranmcshane.github.io/rating-lab/players/","sources":[{"name":"StatsBomb Open Data","url":"https://github.com/statsbomb/open-data"}],"license":"Source-specific terms recorded on each cohort","attribution":"Ratings and analysis are independent of the data providers.","scope":"Complete declared men's and women's tournaments and league seasons only; each cohort records its included competitions, source, and snapshot hash.","statuses":{"api_football_premier_league_2022_23":{"status":"not_configured","provider":"API-Football by API-SPORTS","cohort":"premier-league-2022-23","checked_at":"2026-07-23T21:59:00+00:00","required_matches":380,"required_fields":["stable player ID","starting XI","substitution minute","minutes played","match result"],"message":"API_FOOTBALL_KEY is not configured; Premier League 2022/23 remains withheld."},"api_football_premier_league_2023_24":{"status":"not_configured","provider":"API-Football by API-SPORTS","cohort":"premier-league-2023-24","checked_at":"2026-07-23T21:59:00+00:00","required_matches":380,"required_fields":["stable player ID","starting XI","substitution minute","minutes played","match result"],"message":"API_FOOTBALL_KEY is not configured; Premier League 2023/24 remains withheld."},"api_football_premier_league_2024_25":{"status":"not_configured","provider":"API-Football by API-SPORTS","cohort":"premier-league-2024-25","checked_at":"2026-07-23T21:59:00+00:00","required_matches":380,"required_fields":["stable player ID","starting XI","substitution minute","minutes played","match result"],"message":"API_FOOTBALL_KEY is not configured; Premier League 2024/25 remains withheld."},"api_football_premier_league_2025_26":{"status":"not_configured","provider":"API-Football by API-SPORTS","cohort":"premier-league-2025-26","checked_at":"2026-07-23T21:59:00+00:00","required_matches":380,"required_fields":["stable player ID","starting XI","substitution minute","minutes played","match result"],"message":"API_FOOTBALL_KEY is not configured; Premier League 2025/26 remains withheld."},"api_football_world_cup_2026":{"status":"not_configured","provider":"API-Football by API-SPORTS","cohort":"world-cup-2026","checked_at":"2026-07-23T21:59:00+00:00","required_matches":104,"required_fields":["stable player ID","starting XI","substitution minute","minutes played","match result"],"message":"API_FOOTBALL_KEY is not configured; FIFA World Cup 2026 remains withheld."}}},"methodology":{"inputs":["match outcome","goal difference","goal timing","stable player IDs","lineups","minutes played"],"excluded_inputs":["passes","shots","dribbles","expected goals","tracking data"],"model_hierarchy":{"primary_baselines":["lineup_trueskill","rapm"],"interaction_extensions":["pairwise_chemistry"],"dependency_aware_extensions":["hapm","lapm"],"reason":"Strongly regularized additive models remain primary because sparse football lineup combinations make them more stable, interpretable, and auditable for broad player comparison.","interaction_scope":"Pairwise chemistry estimates explicit residual pair effects. HAPM and LAPM use generalized-lineup dependency structure. All three answer contextual questions and are not portable individual-talent scores.","promotion_rule":"A contextual extension does not replace an additive baseline unless strictly chronological held-out evaluation supports the added complexity."},"lineup_trueskill":"Sequential additive team-skill update using normalized minutes-played weights; every probability is recorded before its match update.","rapm":"Match-level goal-difference ridge regression using normalized minutes weights, home-goal intercept, and a chronological final-quarter penalty selection.","pairwise_chemistry":"Experimental non-additive residual model: exact teammate overlap minutes define pair features, ridge shrinkage is selected on the chronological final quarter, and effects are fitted only to goal difference left unexplained by RAPM.","hapm":"Experimental team-specific Hypergraph Adjusted Plus-Minus adaptation: weighted ridge regression fits player coefficients to an extended incidence matrix containing supported players, pairs, trios, quartets, and full observed lineups. The ridge penalty is chosen chronologically and validation is published against full-lineup APM for every team.","lapm":"Experimental team-specific line-graph APM adaptation: singleton players, qualifying pairs, and full observed constant lineups are graph nodes; non-zero Jaccard overlap creates edges and a Laplacian penalty smooths similar combinations toward one another.","interpretation":"These estimates describe association with team outcomes within one declared complete tournament or season. They do not identify how a player contributed and should not be compared across cohorts."},"cohorts":[{"id":"premier-league-2015-16","name":"Premier League 2015/16","country":"England","gender":"men","format":"club league season","scope_type":"season","season_name":"2015/16","included_competitions":["Premier League"],"scope_note":"Complete 380-match league season. FA Cup, EFL Cup and UEFA fixtures are withheld because the open source does not provide complete lineup-minute coverage for those competitions.","source":{"name":"StatsBomb Open Data","url":"https://github.com/statsbomb/open-data","license":"StatsBomb Open Data terms","raw_responses_published":true},"first_match":"2015-08-08","last_match":"2016-05-17","matches":380,"players_seen":548,"eligible_players":324,"eligibility":{"minimum_minutes":900.0,"minimum_matches":10},"coverage":{"status":"passed","lineup_files":1.0,"starting_lineups":1.0,"player_minutes":1.0,"substitution_minutes":1.0,"lineup_integrity":1.0,"event_goal_scores":1.0,"player_match_graph_components":1,"expected_matches":380,"fixture_completeness":1.0},"snapshot_sha256":"fe60dff28612669af03a897251aacd4db7f976176a811955c555aee8047b37da","data_url":"player-cohort-premier-league-2015-16.json"},{"id":"euro-2024","name":"UEFA Euro 2024","country":"Europe","gender":"men","format":"international tournament","scope_type":"competition","season_name":null,"included_competitions":["UEFA Euro 2024"],"scope_note":null,"source":{"name":"StatsBomb Open Data","url":"https://github.com/statsbomb/open-data","license":"StatsBomb Open Data terms","raw_responses_published":true},"first_match":"2024-06-14","last_match":"2024-07-14","matches":51,"players_seen":488,"eligible_players":51,"eligibility":{"minimum_minutes":450.0,"minimum_matches":5},"coverage":{"status":"passed","lineup_files":1.0,"starting_lineups":1.0,"player_minutes":1.0,"substitution_minutes":1.0,"lineup_integrity":1.0,"event_goal_scores":1.0,"player_match_graph_components":1,"expected_matches":51,"fixture_completeness":1.0},"snapshot_sha256":"58176062c6d716eb5324289ae8d94fafcbf3016f6f444a825394012bd1e7e159","data_url":"player-cohort-euro-2024.json"},{"id":"world-cup-2022","name":"FIFA World Cup 2022","country":"International","gender":"men","format":"international tournament","scope_type":"competition","season_name":null,"included_competitions":["FIFA World Cup 2022"],"scope_note":null,"source":{"name":"StatsBomb Open Data","url":"https://github.com/statsbomb/open-data","license":"StatsBomb Open Data terms","raw_responses_published":true},"first_match":"2022-11-20","last_match":"2022-12-18","matches":64,"players_seen":678,"eligible_players":43,"eligibility":{"minimum_minutes":450.0,"minimum_matches":5},"coverage":{"status":"passed","lineup_files":1.0,"starting_lineups":1.0,"player_minutes":1.0,"substitution_minutes":1.0,"lineup_integrity":0.9844,"event_goal_scores":1.0,"player_match_graph_components":1,"expected_matches":64,"fixture_completeness":1.0},"snapshot_sha256":"00bc457300949b78319f9bc8aac490f13a2f9a0a25ddbfe9cac25cea12474a83","data_url":"player-cohort-world-cup-2022.json"},{"id":"liga-f-2023-24","name":"Liga F 2023/24","country":"Spain","gender":"women","format":"club league season","scope_type":"season","season_name":"2023/24","included_competitions":["Liga F"],"scope_note":"Complete 240-match league season. Copa de la Reina and UEFA fixtures are not included because equivalent complete lineup-minute coverage is unavailable in the open source.","source":{"name":"StatsBomb Open Data","url":"https://github.com/statsbomb/open-data","license":"StatsBomb Open Data terms","raw_responses_published":true},"first_match":"2023-09-15","last_match":"2024-06-16","matches":240,"players_seen":400,"eligible_players":290,"eligibility":{"minimum_minutes":450.0,"minimum_matches":5},"coverage":{"status":"passed","lineup_files":1.0,"starting_lineups":1.0,"player_minutes":1.0,"substitution_minutes":1.0,"lineup_integrity":0.9958,"event_goal_scores":1.0,"player_match_graph_components":1,"expected_matches":240,"fixture_completeness":1.0},"snapshot_sha256":"d16c5d52c1239ac8c85e402bf563bb170b3a270f5147634b9973ce9be9d07e9d","data_url":"player-cohort-liga-f-2023-24.json"},{"id":"wsl-2023-24","name":"FA Women's Super League 2023/24","country":"England","gender":"women","format":"club league season","scope_type":"season","season_name":"2023/24","included_competitions":["Women's Super League"],"scope_note":"Complete 132-match league season. FA Cup, League Cup and UEFA fixtures are not included because equivalent complete lineup-minute coverage is unavailable in the open source.","source":{"name":"StatsBomb Open Data","url":"https://github.com/statsbomb/open-data","license":"StatsBomb Open Data terms","raw_responses_published":true},"first_match":"2023-10-01","last_match":"2024-05-18","matches":132,"players_seen":294,"eligible_players":212,"eligibility":{"minimum_minutes":450.0,"minimum_matches":5},"coverage":{"status":"passed","lineup_files":1.0,"starting_lineups":1.0,"player_minutes":1.0,"substitution_minutes":1.0,"lineup_integrity":1.0,"event_goal_scores":1.0,"player_match_graph_components":1,"expected_matches":132,"fixture_completeness":1.0},"s